parent2_code,parent2_name,parent2_name_EN,parent1_code,parent1_name,parent0_code,parent0_name,parent0_name_EN,short_name,gender,gender_EN,year,prevalence_diff,ci_low,ci_high,se,z,p_value,fold_diff_nat,fold_ci_low_nat,fold_ci_high_nat,ci_width_nat,fold_diff_reg,sig,meta_model_type
I67,Peaajuveresoonte muud haigused,Other cerebrovascular diseases,I60-I69,Peaajuveresoonte haigused e tserebrovaskulaarsed haigused,I00-I99,Vereringeelundite haigused,Diseases of the circulatory system,Circulatory system,M,M,MetaAgeCombined,-0.0075955480648081,-0.109782659445405,0.0945915633157888,0.052137239350639006,-0.14568374082343902,0.8841710573606892,0.9947490022156871,0.9267276619635271,1.0677630743346145,0.1410354123710874,1.0052787163119712,nosig,Random-Effects
I69,Peaajuveresoonte haiguse jääknähud,Sequelae of cerebrovascular disease,I60-I69,Peaajuveresoonte haigused e tserebrovaskulaarsed haigused,I00-I99,Vereringeelundite haigused,Diseases of the circulatory system,Circulatory system,M,M,MetaAgeCombined,0.27407499052713175,-0.04360011540258868,0.5917500964568522,0.16208211397530833,1.690963819542016,0.09084371298490908,1.2092185287410178,0.9702308005625174,1.5070738317138934,0.536843031151376,1.2092185287410178,nosig,Random-Effects
I70,Ateroskleroos,Atherosclerosis,I70-I79,"Arterite, arterioolide ja kapillaaride haigused",I00-I99,Vereringeelundite haigused,Diseases of the circulatory system,Circulatory system,M,M,MetaAgeCombined,0.32850261458819924,0.2734810172782015,0.38352421189819697,0.028072759369050196,11.701828461877835,1.2473641617988267e-31,1.2557093865126268,1.2087207827837672,1.3045246560123047,0.09580387322853756,1.2557093865126268,sig,Random-Effects
I80,Flebiit e veenipõletik ja tromboflebiit e trombveenipõletik,Phlebitis and thrombophlebitis,I80-I89,"Veenide, lümfisoonte ja -sõlmede mujal klassifitseerimata haigused",I00-I99,Vereringeelundite haigused,Diseases of the circulatory system,Circulatory system,M,M,MetaAgeCombined,0.5183238677569689,0.3862976173357907,0.6503501181781471,0.0673615696321894,7.6946524641148315,1.4187927604982672e-14,1.4322902371169466,1.3070348577251347,1.5695490531224485,0.2625141953973138,1.4322902371169466,sig,Random-Effects
I83,Alajäsemete vaariksid e veenikomud,Varicose veins of lower extremities,I80-I89,"Veenide, lümfisoonte ja -sõlmede mujal klassifitseerimata haigused",I00-I99,Vereringeelundite haigused,Diseases of the circulatory system,Circulatory system,M,M,MetaAgeCombined,0.19545753215406814,0.08997408383605514,0.3009409804720811,0.053819074814666495,3.6317519917827177,2.8150359264832273e-4,1.1450872526971052,1.0643510625814485,1.2319476743971995,0.16759661181575103,1.1450872526971052,sig,Random-Effects
I84,Hemorroidid e päraku veenikomud,Hemorrhoids,I80-I89,"Veenide, lümfisoonte ja -sõlmede mujal klassifitseerimata haigused",I00-I99,Vereringeelundite haigused,Diseases of the circulatory system,Circulatory system,M,M,MetaAgeCombined,0.4660962072002622,0.4142831106336956,0.5179093037668288,0.026435739113198856,17.631290927952506,1.4169455952974212e-69,1.3813665625371747,1.3326363124362444,1.4318787221153864,0.099242409679142,1.3813665625371747,sig,Random-Effects
F01,Vaskulaarne dementsus,Vascular dementia,F00-F09,Orgaanilised - k.a sümptomaatilised - psüühikahäired,F00-F99,Psüühika- ja käitumishäired,Mental and behavioural disorders,Mental health disorders,Koos,Both,MetaAgeGenderCombined,-0.22686538048048174,-0.5399696162206565,0.08623885525969302,0.1597499944947464,-1.4201276262825946,0.15557052880224242,0.8544894705568017,0.6877853939741656,1.0615989546877016,0.373813560713536,1.1702894353377824,nosig,Random-Effects
F06,"Muud psüühikahäired ajukahjustusest, -düsfunktsioonist või somaatilisest haigusest",Other mental disorders due to known physiological condition,F00-F09,Orgaanilised - k.a sümptomaatilised - psüühikahäired,F00-F99,Psüühika- ja käitumishäired,Mental and behavioural disorders,Mental health disorders,Koos,Both,MetaAgeGenderCombined,0.3367748238941525,0.2458500311408773,0.4276996166474276,0.04639105283080626,7.259477923952507,3.8858720434093037e-13,1.262930128096483,1.1857912294225141,1.3450871189446798,0.15929588952216567,1.262930128096483,sig,Random-Effects
F07,"Isiksus- ja käitumishäired ajuhaigusest, -kahjustusest või -düsfunktsioonist",Personality and behavioral disorders due to known physiological condition,F00-F09,Orgaanilised - k.a sümptomaatilised - psüühikahäired,F00-F99,Psüühika- ja käitumishäired,Mental and behavioural disorders,Mental health disorders,Koos,Both,MetaAgeGenderCombined,0.20480551486913773,0.07612644030890156,0.33348458942937387,0.0656537954652434,3.119477151592251,0.0018117231132080427,1.1525309672912027,1.0541838097494105,1.260053150390302,0.20586934064089157,1.1525309672912027,sig,Random-Effects
F10,Alkoholi tarvitamisest tingitud psüühika- ja käitumishäired,Alcohol related disorders,F10-F19,Psühhoaktiivsete ainete tarvitamisest tingitud psüühika- ja käitumishäired,F00-F99,Psüühika- ja käitumishäired,Mental and behavioural disorders,Mental health disorders,Koos,Both,MetaAgeGenderCombined,-0.18645237228776657,-0.3414102788027621,-0.03149446577277107,0.07906160916082322,-2.358317447201136,0.018357986626694116,0.8787639719700628,0.7892693995122758,0.9784062563552999,0.18913685684302406,1.1379619919534745,sig,Random-Effects
F20,Skisofreenia,Schizophrenia,F20-F29,"Skisofreenia, skisotüüpsed ja luululised häired",F00-F99,Psüühika- ja käitumishäired,Mental and behavioural disorders,Mental health disorders,Koos,Both,MetaAgeGenderCombined,0.008614519911612486,-0.15294747522536556,0.17017651504859055,0.08243110404648173,0.10450569613570723,0.9167680481708055,1.0059889929223476,0.8994110567692862,1.1251961450375159,0.22578508826822963,1.0059889929223476,nosig,Random-Effects
F32,Depressiivne episood e. depressioon,"Major depressive disorder, single episode",F30-F39,Meeleoluhäired,F00-F99,Psüühika- ja käitumishäired,Mental and behavioural disorders,Mental health disorders,Koos,Both,MetaAgeGenderCombined,0.5191046773293688,0.45407122799572774,0.5841381266630099,0.03318094100025134,15.644664125873847,3.612703027453445e-55,1.4330656252508376,1.3699006123227293,1.4991431260063974,0.12924251368366813,1.4330656252508376,sig,Random-Effects
F33,Korduv depressiivne häire e korduv depressioon,"Major depressive disorder, recurrent",F30-F39,Meeleoluhäired,F00-F99,Psüühika- ja käitumishäired,Mental and behavioural disorders,Mental health disorders,Koos,Both,MetaAgeGenderCombined,0.7933670215924253,0.7096940120901806,0.8770400310946701,0.04269109542942974,18.583899373205263,4.338082450815272e-77,1.7331145610350267,1.635457208592484,1.8366032849350318,0.20114607634254789,1.7331145610350267,sig,Random-Effects
F40,Foobsed ärevushäired e. foobiad,Phobic anxiety disorders,F40-F49,"Neurootilised, stressiga seotud ja somatoformsed häired",F00-F99,Psüühika- ja käitumishäired,Mental and behavioural disorders,Mental health disorders,Koos,Both,MetaAgeGenderCombined,0.7366409826050616,0.41717094335725224,1.056111021852871,0.16299791310847972,4.5193276929552235,6.203631252933694e-6,1.6662917028717075,1.3353065129307249,2.079318877105739,0.744012364175014,1.6662917028717075,sig,Random-Effects
F41,Muud ärevushäired,Other anxiety disorders,F40-F49,"Neurootilised, stressiga seotud ja somatoformsed häired",F00-F99,Psüühika- ja käitumishäired,Mental and behavioural disorders,Mental health disorders,Koos,Both,MetaAgeGenderCombined,0.4222815947139289,0.33508481376489807,0.5094783756629597,0.04448897104070684,9.491826509710611,2.2702097222898378e-21,1.3400451357329115,1.2614515653984284,1.4235354056057317,0.16208384020730326,1.3400451357329115,sig,Random-Effects
F43,Rasked stressreaktsioonid ja kohanemishäired,"Reaction to severe stress, and adjustment disorders",F40-F49,"Neurootilised, stressiga seotud ja somatoformsed häired",F00-F99,Psüühika- ja käitumishäired,Mental and behavioural disorders,Mental health disorders,Koos,Both,MetaAgeGenderCombined,0.44592197322838073,0.34421570062509455,0.5476282458316669,0.05189190893584388,8.593285203280777,8.451740849411651e-18,1.3621843602191943,1.2694606717913737,1.461680753455213,0.1922200816638393,1.3621843602191943,sig,Random-Effects
F45,Somatoformsed häired,Somatoform disorders,F40-F49,"Neurootilised, stressiga seotud ja somatoformsed häired",F00-F99,Psüühika- ja käitumishäired,Mental and behavioural disorders,Mental health disorders,Koos,Both,MetaAgeGenderCombined,0.18890000464477047,0.08263086299395837,0.29516914629558255,0.05421994612607658,3.4839578078060978,4.940573660222467e-4,1.1398942621758281,1.0589473511034504,1.227028829702827,0.1680814785993765,1.1398942621758281,sig,Random-Effects
F48,Muud neurootilised häired,Other nonpsychotic mental disorders,F40-F49,"Neurootilised, stressiga seotud ja somatoformsed häired",F00-F99,Psüühika- ja käitumishäired,Mental and behavioural disorders,Mental health disorders,Koos,Both,MetaAgeGenderCombined,-0.11787376459041134,-0.24829123985917517,0.012543710678352513,0.06654075090026158,-1.7714522754198128,0.07648552219381947,0.9215448175829278,0.8418929817592351,1.0087325458389664,0.16683956407973133,1.085134418771784,nosig,Random-Effects
F51,Mitteorgaanilised unehäired,Sleep disorders not due to a substance or known physiological condition,F50-F59,Füsioloogiliste funktsioonide häirete ja füüsiliste e somaatiliste teguritega seotud käitumissündroomid,F00-F99,Psüühika- ja käitumishäired,Mental and behavioural disorders,Mental health disorders,Koos,Both,MetaAgeGenderCombined,0.46235850826878955,0.3444934730815498,0.5802235434560292,0.06013632705342758,7.688505948459594,1.4886309870768136e-14,1.3777923838698158,1.2697051137196467,1.4950808912539522,0.2253757775343055,1.3777923838698158,sig,Random-Effects
F52,Mitteorgaanilised seksuaaldüsfunktsioonid,Sexual dysfunction not due to a substance or known physiological condition,F50-F59,Füsioloogiliste funktsioonide häirete ja füüsiliste e somaatiliste teguritega seotud käitumissündroomid,F00-F99,Psüühika- ja käitumishäired,Mental and behavioural disorders,Mental health disorders,Koos,Both,MetaAgeGenderCombined,0.47082506711290106,0.3241911151940068,0.6174590190317953,0.07481461551106255,6.293223107499389,3.109409175392776e-10,1.385901828992333,1.2519622963140473,1.534170705666756,0.28220840935270863,1.385901828992333,sig,Random-Effects
F70,Kerge vaimne alaareng,Mild intellectual disabilities,F70-F79,Vaimne alaareng,F00-F99,Psüühika- ja käitumishäired,Mental and behavioural disorders,Mental health disorders,Koos,Both,MetaAgeGenderCombined,-0.059254401788023825,-0.30385064606562084,0.1853418424895732,0.12479629534365991,-0.47480898070612604,0.6349231312785117,0.9597600040696987,0.8100873329817162,1.1370863707020318,0.3269990377203156,1.0419271440356657,nosig,Random-Effects
I10,Hüpertooniatõbi e essentsiaalne e primaarne arteriaalne hüpertensioon e kõrgvererõhktõbi,Essential (primary) hypertension,I10-I15,Kõrgvererõhkhaigused,I00-I99,Vereringeelundite haigused,Diseases of the circulatory system,Circulatory system,Koos,Both,MetaAgeGenderCombined,0.1920160490544166,0.10708290918223788,0.2769491889265953,0.04333403090164948,4.431068263421293,9.376739683128643e-6,1.1423589547864903,1.0770482705109603,1.2116299866131237,0.1345817161021634,1.1423589547864903,sig,Random-Effects
I11,Südamekahjustusega hüpertooniatõbi,Hypertensive heart disease,I10-I15,Kõrgvererõhkhaigused,I00-I99,Vereringeelundite haigused,Diseases of the circulatory system,Circulatory system,Koos,Both,MetaAgeGenderCombined,0.2902705890479822,0.19365075735417597,0.3868904207417884,0.049296738335975136,5.888231125347136,3.903509672646682e-9,1.2228696152072938,1.14365408784941,1.307572028714807,0.16391794086539702,1.2228696152072938,sig,Random-Effects
I13,Südame- ja neerukahjustusega hüpertooniatõbi,Hypertensive heart and chronic kidney disease,I10-I15,Kõrgvererõhkhaigused,I00-I99,Vereringeelundite haigused,Diseases of the circulatory system,Circulatory system,Koos,Both,MetaAgeGenderCombined,0.2517502631502843,0.10414106213889654,0.3993594641616721,0.0753122007219063,3.3427553668214203,8.295099217084358e-4,1.190650724653658,1.0748542635537028,1.318922198281303,0.24406793472760024,1.190650724653658,sig,Random-Effects
I20,Stenokardia e rinnaangiin e rinnaahistus,Angina pectoris,I20-I25,Südame isheemiatõved,I00-I99,Vereringeelundite haigused,Diseases of the circulatory system,Circulatory system,Koos,Both,MetaAgeGenderCombined,0.5571514444605626,0.4401578064624614,0.6741450824586639,0.05969172848120282,9.33381322063763,1.0212894143345423e-20,1.4713611913902707,1.356752725156579,1.5956509357882818,0.2388982106317028,1.4713611913902707,sig,Random-Effects
I25,Krooniline südame isheemiatõbi,Chronic ischemic heart disease,I20-I25,Südame isheemiatõved,I00-I99,Vereringeelundite haigused,Diseases of the circulatory system,Circulatory system,Koos,Both,MetaAgeGenderCombined,0.4851300167606336,0.32127633083465246,0.6489837026866148,0.0836003555261414,5.8029659528055,6.515202497163522e-9,1.3997120030082884,1.2494354170205737,1.5680631945246144,0.3186277775040407,1.3997120030082884,sig,Random-Effects
I48,Kodade virvendus ja laperdus,Atrial fibrillation and flutter,I30-I52,Muud südamehaigused,I00-I99,Vereringeelundite haigused,Diseases of the circulatory system,Circulatory system,Koos,Both,MetaAgeGenderCombined,0.5306652085064628,0.3307872174360962,0.7305431995768294,0.10198044078716689,5.203597909661528,1.9546669351378187e-7,1.444595126596527,1.2576994605224372,1.65926371545041,0.40156425492797276,1.444595126596527,sig,Random-Effects
I49,Muud südamerütmitused e arütmiad,Other cardiac arrhythmias,I30-I52,Muud südamehaigused,I00-I99,Vereringeelundite haigused,Diseases of the circulatory system,Circulatory system,Koos,Both,MetaAgeGenderCombined,0.5097979323618441,0.4493362972370393,0.570259567486649,0.030848339868343767,16.525943844550067,2.3867418657467035e-61,1.4238507533722047,1.3654119630742199,1.4847906878697779,0.119378724795558,1.4238507533722047,sig,Random-Effects
I50,Südamepuudulikkus,Heart failure,I30-I52,Muud südamehaigused,I00-I99,Vereringeelundite haigused,Diseases of the circulatory system,Circulatory system,Koos,Both,MetaAgeGenderCombined,0.4123831838182923,0.3158186133013391,0.5089477543352455,0.04926854333989923,8.37011114725471,5.756391199962742e-17,1.3308824802323729,1.2447177300729284,1.4230119274397208,0.17829419736679242,1.3308824802323729,sig,Random-Effects
I63,Peaajuinfarkt,Cerebral infarction,I60-I69,Peaajuveresoonte haigused e tserebrovaskulaarsed haigused,I00-I99,Vereringeelundite haigused,Diseases of the circulatory system,Circulatory system,Koos,Both,MetaAgeGenderCombined,0.11075047488377297,-0.09912350963281565,0.3206244594003616,0.10708053115876,1.0342727448706044,0.30100867469732384,1.079789785798246,0.9336000156663665,1.2488709960892794,0.3152709804229129,1.079789785798246,nosig,Random-Effects
I67,Peaajuveresoonte muud haigused,Other cerebrovascular diseases,I60-I69,Peaajuveresoonte haigused e tserebrovaskulaarsed haigused,I00-I99,Vereringeelundite haigused,Diseases of the circulatory system,Circulatory system,Koos,Both,MetaAgeGenderCombined,-0.06967955176034568,-0.21224761940682813,0.07288851588613676,0.07274014664097973,-0.9579242684821617,0.3381009479345213,0.9528496193959471,0.8631913905429414,1.051820496740502,0.18862910619756068,1.0494835487618115,nosig,Random-Effects
I69,Peaajuveresoonte haiguse jääknähud,Sequelae of cerebrovascular disease,I60-I69,Peaajuveresoonte haigused e tserebrovaskulaarsed haigused,I00-I99,Vereringeelundite haigused,Diseases of the circulatory system,Circulatory system,Koos,Both,MetaAgeGenderCombined,0.1809277331514104,-0.020875530593991498,0.3827309968968123,0.10296274081421922,1.7572155880918834,0.07888106926422812,1.1336126269286082,0.9856343694853927,1.3038076062657278,0.31817323678033504,1.1336126269286082,nosig,Random-Effects
I70,Ateroskleroos,Atherosclerosis,I70-I79,"Arterite, arterioolide ja kapillaaride haigused",I00-I99,Vereringeelundite haigused,Diseases of the circulatory system,Circulatory system,Koos,Both,MetaAgeGenderCombined,0.2880193316900782,0.2122912795435774,0.363747383836579,0.038637471271836636,7.454404292239987,9.027477986091065e-14,1.2209628731036357,1.1585266886519856,1.2867639149789991,0.1282372263270135,1.2209628731036357,sig,Random-Effects
I80,Flebiit e veenipõletik ja tromboflebiit e trombveenipõletik,Phlebitis and thrombophlebitis,I80-I89,"Veenide, lümfisoonte ja -sõlmede mujal klassifitseerimata haigused",I00-I99,Vereringeelundite haigused,Diseases of the circulatory system,Circulatory system,Koos,Both,MetaAgeGenderCombined,0.41657933770989747,0.33426504617470804,0.4988936292450869,0.04199785923847279,9.919061239394876,3.439760599344808e-23,1.3347590563294764,1.2607349875083496,1.4131294491751822,0.15239446166683268,1.3347590563294764,sig,Random-Effects
I83,Alajäsemete vaariksid e veenikomud,Varicose veins of lower extremities,I80-I89,"Veenide, lümfisoonte ja -sõlmede mujal klassifitseerimata haigused",I00-I99,Vereringeelundite haigused,Diseases of the circulatory system,Circulatory system,Koos,Both,MetaAgeGenderCombined,0.1599803138132516,0.10251233564597859,0.2174482919805246,0.029320935803194906,5.456180351372674,4.8648582050084926e-8,1.1172718923185696,1.0736414945726145,1.1626753321992533,0.08903383762663886,1.1172718923185696,sig,Random-Effects
I84,Hemorroidid e päraku veenikomud,Hemorrhoids,I80-I89,"Veenide, lümfisoonte ja -sõlmede mujal klassifitseerimata haigused",I00-I99,Vereringeelundite haigused,Diseases of the circulatory system,Circulatory system,Koos,Both,MetaAgeGenderCombined,0.3682815358851231,0.2981337911366847,0.43842928063356146,0.03579032334356898,10.289975096056184,7.819659529895649e-25,1.290814362883005,1.2295528869511672,1.3551281421953454,0.12557525524417823,1.290814362883005,sig,Random-Effects
